text,likes,commenter_name,commenter_url,account_type,occupation,followers,location,position,industry,size
Proud to be part of this important initiative and very excited to see how AI can support climate resilience in communities that are most affected.,5,Salah Said,https://www.linkedin.com/in/salah-said,Individual,Klarna,6191,Spanien,Director of Sustainability | ESG,,
"Extraordinary cool!Salah Said,Petter William Sundelin, Nina Siemiatkowski and all involved!",3,Katarina Wangler Björk,https://www.linkedin.com/in/katarinabjork,Individual,Exponential Roadmap Initiative,5931,Schweden,Chief Impact Officer,,
Glad to be part of this initiative—putting AI to work for climate resilience where it matters most 🙌,5,Petter William Sundelin,https://www.linkedin.com/in/petter-william-sundelin,Individual,Klarna,1231,Schweden,Global Product Growth Lead · Core Product Growth,,
"KlarnaWell dang, talk about an awesome opportunity! Time to save this and see if I can apply. 😎🤔",0,Nathaniel Burola,https://www.linkedin.com/in/nathaniel-burola-5763ab49,Individual,RAND School of Public Policy,8541,Vereinigte Staaten von Amerika,"The Digital Economist is a thought-leadership and impact organization dedicated to shaping a more human-centered global economy. Through research, convening, and public advocacy, it brings together policymakers, technologists, academics, and business leaders to explore how digital innovations can advance sustainable, inclusive growth.At the heart of this work is the Executive Fellowship, an exclusive program for visionary leaders committed to accelerating transformative change on a global scale. Fellows are integrated into The Digital Economist’s Center of Excellence, contributing to high-level initiatives, publications, and public discourse. With a minimum commitment of just 24 hours per year, Fellows engage in monthly meetings, receive speaking opportunities, and convene in regional and global forums including representation at Davos and other flagship global events.",,
Fantastic teamKlarna!,0,BorderlessCX™,https://www.linkedin.com/company/borderlesscx/posts,Company,,2236,Dallas,,Unternehmensberatung,11-50
Good very good,0,Balla Jaisheel,https://www.linkedin.com/in/ballajaisheel,Individual,Brandenburgische Technische Universität Cottbus-Senftenberg,86,Deutschland,Associate Software Engineer (AI-ML),,
Well done! You make lives of people so much easier and prettier! :) AI will definitely ease things even more!,0,Natalja Ļefonova,https://www.linkedin.com/in/natalja-%C4%BCefonova-7b255a46,Individual,DCsolution,867,Portugal,Account Manager,,
Super interesting teamKlarna♻️ 💚 🏗️,1,Plantmore.com - More for nature,https://www.linkedin.com/company/plantmore/posts,Company,,1872,Vastra Gotaland County,,Umweltdienstleistungen,2-10
